{
  "schema": "inside-valdivia.h3-prompting-catalog/1",
  "source": {
    "repository": "https://github.com/MiniMax-AI/MiniMax-H3",
    "commit": "d21241f0a4b3acbb34c97dae47fa417b7065e438",
    "observed_at": "2026-09-03",
    "files": [
      {
        "path": ".agents/skills/h3-prompt-writing/SKILL.md",
        "sha256": "a48f9db1231cebe6b141985a0932e2ee83e3d29574387a7b1fddd4c3173759ed"
      },
      {
        "path": ".agents/skills/h3-prompt-writing/references/base-en.txt",
        "sha256": "2cfebc096a6e08370f288d468d90b60f7f9bcb938f94bf090816e910e48e75fc"
      },
      {
        "path": ".agents/skills/h3-prompt-writing/references/ref-en.txt",
        "sha256": "1e574f356716ad55612247ffb7bbccbcdb484ad96599d63c7dca1af186b1fab7"
      }
    ]
  },
  "policy": {
    "language": "English",
    "media_semantics": "opaque-human-authored-intent",
    "generated_audio": "disabled",
    "comparison_unit": "one-prompt-variable"
  },
  "matrices": [
    {
      "id": "fl2va-prompt-form",
      "experiment_id": "h3-fl2va-prompt-form",
      "stage": 1,
      "mode": "FL2VA",
      "operation": { "id": "generate.keyframed", "version": 2 },
      "target": { "fps": 24, "frames": 124, "duration_seconds": 5.17 },
      "fixed": ["first frame", "last frame", "model", "resolution", "seed", "sampler", "scheduler", "steps"],
      "variants": [
        {
          "id": "terse-learned-phrase",
          "hypothesis": "The terse phrase is a useful empirical baseline because it may activate a learned transition concept despite omitting the public H3 structure.",
          "prompt": "infinite fast zoom transition into"
        },
        {
          "id": "concise-official-path",
          "hypothesis": "The public FL2VA alignment and path grammar improves temporal use of both endpoints without overconstraining the five-second shot.",
          "prompt": "How the reference pictures align with the target video — Picture 1 (from Shot 1) aligns with the 0.00-second mark of the target video; Picture 2 (from Shot 1) aligns with the 5.17-second mark of the target video.\n\nintegrated_multimodal_description: [Shot 1] The shot begins in the viewpoint and composition established by Picture 1. In one uninterrupted shot, a continuous fast forward transition advances through the visible space. Parallax, scale, and occlusion evolve coherently at every intermediate moment without a reset. The trajectory progressively narrows the spatial difference and reaches the viewpoint, geometry, and composition established by Picture 2 only at the end of the shot.\n\noverall_soundscape: N/A\n\nnon_diegetic_music: N/A"
        },
        {
          "id": "timed-official-path",
          "hypothesis": "Three observable temporal phases give the language model a stronger motion path than either a slogan or an untimed paragraph.",
          "prompt": "How the reference pictures align with the target video — Picture 1 (from Shot 1) aligns with the 0.00-second mark of the target video; Picture 2 (from Shot 1) aligns with the 5.17-second mark of the target video.\n\nintegrated_multimodal_description: [Shot 1] The shot begins in the exact viewpoint and composition established by Picture 1. From 0.00 to 1.50 seconds, one uninterrupted fast forward movement establishes a stable direction through the visible space. From 1.50 to 3.80 seconds, the movement continues without cuts as parallax, scale, occlusion, and newly revealed regions change continuously along the same trajectory. From 3.80 to 5.17 seconds, the rate eases only enough to converge precisely, with the remaining geometric and compositional differences progressively disappearing until the shot reaches Picture 2 at the final moment.\n\noverall_soundscape: N/A\n\nnon_diegetic_music: N/A"
        }
      ],
      "measures": ["prompt sensitivity at fixed seed", "first-frame fidelity", "last-frame fidelity", "continuous-path coherence", "early landing or terminal hold", "cuts, dissolves, or resets"],
      "status": "planned"
    },
    {
      "id": "fl2va-camera-semantics",
      "experiment_id": "h3-fl2va-camera-semantics",
      "stage": 1,
      "mode": "FL2VA",
      "operation": { "id": "generate.keyframed", "version": 2 },
      "target": { "fps": 24, "frames": 124, "duration_seconds": 5.17 },
      "fixed": ["first frame", "last frame", "public FL2VA structure", "all wording except the motion clause", "model", "resolution", "seed", "sampler", "scheduler", "steps"],
      "variants": [
        {
          "id": "optical-zoom",
          "hypothesis": "Explicit focal-length language yields scale change with less translation and parallax.",
          "prompt": "How the reference pictures align with the target video — Picture 1 (from Shot 1) aligns with the 0.00-second mark of the target video; Picture 2 (from Shot 1) aligns with the 5.17-second mark of the target video.\n\nintegrated_multimodal_description: [Shot 1] The shot begins in the viewpoint and composition established by Picture 1. The camera body remains stationary while the lens zooms in with large amplitude at fast speed. The focal-length change continuously enlarges the visible composition without camera translation, a cut, or a reset, and converges to the framing and composition established by Picture 2 only at the final moment.\n\noverall_soundscape: N/A\n\nnon_diegetic_music: N/A"
        },
        {
          "id": "physical-push",
          "hypothesis": "Explicit camera translation yields parallax and occlusion changes distinct from an optical zoom.",
          "prompt": "How the reference pictures align with the target video — Picture 1 (from Shot 1) aligns with the 0.00-second mark of the target video; Picture 2 (from Shot 1) aligns with the 5.17-second mark of the target video.\n\nintegrated_multimodal_description: [Shot 1] The shot begins in the viewpoint and composition established by Picture 1. The camera physically pushes forward with large amplitude at fast speed while its focal length remains stable. Translation through the visible space creates continuous parallax, occlusion, and depth change without a cut or reset, and converges to the viewpoint and composition established by Picture 2 only at the final moment.\n\noverall_soundscape: N/A\n\nnon_diegetic_music: N/A"
        },
        {
          "id": "recursive-traverse",
          "hypothesis": "A learned infinite-transition phrase plus physical continuity language may produce a nested spatial traverse rather than a literal lens zoom.",
          "prompt": "How the reference pictures align with the target video — Picture 1 (from Shot 1) aligns with the 0.00-second mark of the target video; Picture 2 (from Shot 1) aligns with the 5.17-second mark of the target video.\n\nintegrated_multimodal_description: [Shot 1] The shot begins in the viewpoint and composition established by Picture 1. An infinite fast zoom transition travels forward into the visible space as one physically continuous trajectory: foreground regions pass the camera, deeper regions expand into view, and each revealed layer becomes the space of the next moment. The motion never cuts, dissolves, teleports, or resets and reaches the viewpoint and composition established by Picture 2 only at the final moment.\n\noverall_soundscape: N/A\n\nnon_diegetic_music: N/A"
        }
      ],
      "measures": ["apparent focal-length change", "camera-translation parallax", "occlusion continuity", "motion magnitude", "endpoint fidelity"],
      "status": "planned"
    },
    {
      "id": "fl2va-temporal-profile",
      "experiment_id": "h3-fl2va-temporal-profile",
      "stage": 1,
      "mode": "FL2VA",
      "operation": { "id": "generate.keyframed", "version": 2 },
      "target": { "fps": 24, "frames": 124, "duration_seconds": 5.17 },
      "fixed": ["first frame", "last frame", "physical push motion", "public FL2VA structure", "model", "resolution", "seed", "sampler", "scheduler", "steps"],
      "variants": [
        {
          "id": "uniform",
          "hypothesis": "An explicit uniform rate produces the smoothest velocity trace but may weaken the final landing.",
          "prompt": "How the reference pictures align with the target video — Picture 1 (from Shot 1) aligns with the 0.00-second mark of the target video; Picture 2 (from Shot 1) aligns with the 5.17-second mark of the target video.\n\nintegrated_multimodal_description: [Shot 1] The shot begins in the viewpoint and composition established by Picture 1. The camera physically pushes forward at one constant speed along one uninterrupted trajectory for the entire shot. Parallax and occlusion evolve continuously at a uniform rate, and the camera reaches the viewpoint and composition established by Picture 2 exactly at 5.17 seconds.\n\noverall_soundscape: N/A\n\nnon_diegetic_music: N/A"
        },
        {
          "id": "accelerating",
          "hypothesis": "A monotonic acceleration instruction produces a measurable increase in motion magnitude across the shot.",
          "prompt": "How the reference pictures align with the target video — Picture 1 (from Shot 1) aligns with the 0.00-second mark of the target video; Picture 2 (from Shot 1) aligns with the 5.17-second mark of the target video.\n\nintegrated_multimodal_description: [Shot 1] The shot begins in the viewpoint and composition established by Picture 1. The camera physically pushes forward in one uninterrupted trajectory, beginning slowly and accelerating continuously without any deceleration. Parallax, occlusion, and the rate of newly revealed space increase throughout the shot, and the fastest movement reaches the viewpoint and composition established by Picture 2 exactly at 5.17 seconds.\n\noverall_soundscape: N/A\n\nnon_diegetic_music: N/A"
        },
        {
          "id": "accelerate-then-land",
          "hypothesis": "Acceleration followed by a short deceleration window improves both dynamic motion and terminal anchor fidelity.",